{
  "$schema": "https://json.schemastore.org/ag-custom-config.json",
  "version": "2.4.2",
  "updatedAt": "2026-08-01T17:22:01+07:00",
  "installMode": "copy",
  "symlinkScope": "bulk",
  "kitRepoPath": "/home/ngxc/workspace/40-tools/agent-skills-kit",
  "targets": [
    ".claude",
    ".omp",
    ".codex",
    ".agents",
    "process/development-protocols",
    "process/context"
  ],
  "symlinkTargets": [
    ".claude",
    ".omp",
    ".codex",
    ".agents",
    "process/development-protocols",
    "process/context"
  ],
  "skills": {
    "mode": "select",
    "include": [
      "ag-audit-ag",
      "ag-audit-context",
      "ag-audit-plans",
      "ag-autoresearch",
      "ag-brainstorming",
      "ag-code-interrogation",
      "ag-debug",
      "ag-docs",
      "ag-docs-seeker",
      "ag-frontend-design",
      "ag-generate-context",
      "ag-generate-plan",
      "ag-git-flow",
      "ag-harness-sync",
      "ag-mcp-management",
      "ag-predict",
      "ag-preview",
      "ag-repomix",
      "ag-scenario",
      "ag-scout",
      "ag-second-brain",
      "ag-security",
      "ag-setup",
      "ag-strict-config-derivation",
      "ag-team",
      "ag-tech-graph",
      "ag-watzup",
      "ag-web-testing",
      "ag-workflow-doc",
      "ag-xia",
      "code-simplifier",
      "drizzle",
      "implementation-design-patterns",
      "implementation-functional-patterns",
      "nextjs",
      "nextjs-bundle-optimizer",
      "nextjs-ppr-patterns",
      "react-hook-form",
      "react-hook-form-audit",
      "tailwind",
      "tailwind-refactor",
      "tailwind-responsive-ui",
      "tailwind-ui-refactor",
      "typescript",
      "typescript-advanced-patterns",
      "typescript-refactor",
      "ui-design",
      "upstash-ratelimit",
      "zod",
      "zustand"
    ],
    "exclude": []
  },
  "options": {
    "preserveUserContent": true,
    "refuseOverwriteNonSymlinkDir": true
  }
}
